{
  "id": "g2",
  "matiere": "histoire-geo",
  "titre": "Dynamiques territoriales, coopérations et tensions dans la mondialisation",
  "maj": "2026-10-17",
  "rattachement": {
    "theme": "Géographie – Les territoires dans la mondialisation : entre intégrations et rivalités",
    "intitule": "Dynamiques territoriales, coopérations et tensions dans la mondialisation",
    "certitude": "certain",
    "source": {
      "titre": "Programme d'histoire-géographie de terminale générale, BO spécial n° 8 du 25 juillet 2019, annexe 1",
      "url": "https://eduscol.education.gouv.fr/sites/default/files/document/spe243annexe11159172pdf-83013.pdf"
    }
  },
  "objectifs": [
    "Montrer que les territoires sont inégalement intégrés dans la mondialisation (centres, périphéries, marges).",
    "Comprendre les coopérations, les tensions et les régulations aux échelles mondiale, régionale et locale.",
    "Analyser le rayonnement international et l'attractivité de la France."
  ],
  "parties": [
    {
      "id": "points",
      "titre": "Les questions du programme",
      "blocs": [
        {
          "type": "paragraphe",
          "texte": "Le programme demande d'étudier précisément :"
        },
        {
          "type": "liste",
          "items": [
            "Des territoires inégalement intégrés dans la mondialisation.",
            "Coopérations, tensions et régulations aux échelles mondiale, régionale et locale.",
            "Question spécifique sur la France : un rayonnement international différencié et une inégale attractivité dans la mondialisation."
          ]
        },
        {
          "type": "piege",
          "titre": "à connaître par cœur",
          "texte": "Ces points sont cités mot pour mot par le programme : un sujet ou un document peut porter directement sur eux."
        }
      ]
    },
    {
      "id": "integration",
      "titre": "Des territoires inégalement intégrés",
      "blocs": [
        {
          "type": "definition",
          "glossaire": "mondialisation"
        },
        {
          "type": "definition",
          "glossaire": "metropolisation"
        },
        {
          "type": "paragraphe",
          "texte": "**Les centres** : les **métropoles mondiales** (New York, Londres, Tokyo, Paris, Shanghai) concentrent les sièges sociaux, les places financières, les universités, les aéroports. Les grandes **façades maritimes** et les régions industrielles d'Asie orientale sont très intégrées."
        },
        {
          "type": "paragraphe",
          "texte": "**Les espaces moins intégrés** : régions rurales isolées, pays les moins avancés, espaces en crise ou en guerre (Sahel). Même dans un pays riche, certains territoires restent à l'écart (zones rurales en déclin, quartiers pauvres)."
        },
        {
          "type": "a-retenir",
          "texte": "L'intégration dépend de l'échelle : il y a des territoires intégrés dans les pays pauvres, et des territoires délaissés dans les pays riches."
        }
      ]
    },
    {
      "id": "cooperations",
      "titre": "Coopérations, tensions, régulations",
      "blocs": [
        {
          "type": "tableau",
          "titre": "Selon l'échelle",
          "colonnes": [
            "Échelle",
            "Coopérations et régulations",
            "Tensions"
          ],
          "lignes": [
            [
              "Mondiale",
              "OMC (1995), ONU, accords sur le climat",
              "Guerres commerciales (États-Unis–Chine depuis 2018)"
            ],
            [
              "Régionale",
              "UE, ASEAN (1967), Mercosur (1991), ACEUM (2020)",
              "Concurrence entre zones, différends frontaliers"
            ],
            [
              "Locale",
              "Coopération entre villes, zones franches",
              "Conflits d'usage (terres, eau), délocalisations"
            ]
          ]
        }
      ]
    },
    {
      "id": "france",
      "titre": "La France : rayonnement et attractivité",
      "blocs": [
        {
          "type": "paragraphe",
          "texte": "**Atouts** : la France est l'un des premiers pays touristiques du monde ; Paris est une métropole mondiale ; la langue française et la francophonie (OIF), la culture, la diplomatie (membre permanent du Conseil de sécurité) et de grandes entreprises renforcent son rayonnement."
        },
        {
          "type": "paragraphe",
          "texte": "**Mais une attractivité inégale** : Paris et les grandes métropoles (Lyon, Toulouse, Marseille…) attirent investissements et talents, tandis que certains espaces ruraux ou anciens bassins industriels restent en retrait."
        }
      ]
    }
  ],
  "reperes": [
    {
      "type": "date",
      "libelle": "Création de l'OMC",
      "valeur": "1995",
      "certitude": "certain",
      "source": {
        "titre": "Repère historique (date ou fait établi)"
      }
    },
    {
      "type": "date",
      "libelle": "Création de l'ASEAN",
      "valeur": "1967",
      "certitude": "certain",
      "source": {
        "titre": "Repère historique (date ou fait établi)"
      }
    },
    {
      "type": "date",
      "libelle": "Création du Mercosur",
      "valeur": "1991",
      "certitude": "certain",
      "source": {
        "titre": "Repère historique (date ou fait établi)"
      }
    },
    {
      "type": "date",
      "libelle": "ACEUM (accord États-Unis–Mexique–Canada) remplace l'ALENA",
      "valeur": "2020",
      "certitude": "certain",
      "source": {
        "titre": "Repère historique (date ou fait établi)"
      }
    }
  ],
  "synthese": {
    "type": "tableau",
    "titre": "Intégration inégale",
    "colonnes": [
      "Très intégrés",
      "Moins intégrés"
    ],
    "lignes": [
      [
        "Métropoles mondiales, façades maritimes",
        "Espaces ruraux isolés, PMA"
      ],
      [
        "Régions industrielles d'Asie orientale",
        "Espaces en crise ou en guerre (Sahel)"
      ]
    ]
  },
  "fiche": [
    "**Mondialisation** : intégration inégale des territoires.",
    "**Centres** : métropoles mondiales, façades maritimes.",
    "**Marges** : PMA, espaces isolés ou en crise.",
    "**Régulations** : OMC (1995), accords régionaux (ASEAN 1967, Mercosur 1991, ACEUM 2020).",
    "**Tensions** : guerre commerciale États-Unis–Chine.",
    "**France** : rayonnement (tourisme, Paris, francophonie) mais attractivité inégale."
  ],
  "quiz": [
    {
      "id": "q1",
      "enonce": "L'OMC est créée en…",
      "certitude": "certain",
      "source": {
        "titre": "Repère géographique"
      },
      "choix": [
        {
          "id": "a",
          "texte": "1995",
          "correct": true,
          "explication": "Elle régule le commerce mondial."
        },
        {
          "id": "b",
          "texte": "1945",
          "correct": false,
          "explication": "Non."
        }
      ]
    },
    {
      "id": "q2",
      "enonce": "Une métropole mondiale concentre…",
      "certitude": "certain",
      "source": {
        "titre": "Repère géographique"
      },
      "choix": [
        {
          "id": "a",
          "texte": "des fonctions de commandement",
          "correct": true,
          "explication": "Sièges sociaux, finance…"
        },
        {
          "id": "b",
          "texte": "seulement des usines",
          "correct": false,
          "explication": "Non."
        }
      ]
    },
    {
      "id": "q3",
      "enonce": "Le Mercosur rassemble des pays…",
      "certitude": "certain",
      "source": {
        "titre": "Repère géographique"
      },
      "choix": [
        {
          "id": "a",
          "texte": "d'Amérique du Sud",
          "correct": true,
          "explication": "1991."
        },
        {
          "id": "b",
          "texte": "d'Asie",
          "correct": false,
          "explication": "C'est l'ASEAN."
        }
      ]
    },
    {
      "id": "q4",
      "enonce": "L'intégration dans la mondialisation est…",
      "certitude": "certain",
      "source": {
        "titre": "Repère géographique"
      },
      "choix": [
        {
          "id": "a",
          "texte": "inégale à toutes les échelles",
          "correct": true,
          "explication": "Même dans les pays riches."
        },
        {
          "id": "b",
          "texte": "identique partout",
          "correct": false,
          "explication": "Non."
        }
      ]
    },
    {
      "id": "q5",
      "enonce": "La métropolisation est…",
      "certitude": "certain",
      "source": {
        "titre": "Repère géographique"
      },
      "choix": [
        {
          "id": "a",
          "texte": "la concentration des populations et des activités dans les grandes villes",
          "correct": true,
          "explication": "Processus clé."
        },
        {
          "id": "b",
          "texte": "le déclin des villes",
          "correct": false,
          "explication": "Non."
        }
      ]
    }
  ]
}